{
  "id": "task_20260423_001",
  "type": "repo.inspect",
  "title": "Inspect repository state",
  "targetHost": "hetzner",
  "repo": {
    "slug": "owner/repo",
    "branch": "main",
    "localPath": "/srv/bobek/repos/owner__repo"
  },
  "status": "queued",
  "createdAt": "2026-04-23T18:00:00Z",
  "startedAt": null,
  "finishedAt": null,
  "requestedBy": "master-jack",
  "workerId": null,
  "logPath": null,
  "artifactDir": null,
  "input": {
    "readOnly": true
  },
  "result": null,
  "error": null
}
